{
  "source_id": "pgrs_youtube_48_laws_shadow",
  "title": "As 48 Leis do Poder: o manual que escancara a sombra humana",
  "creator": null,
  "source_class": "modern_esoteric",
  "work_type": "video",
  "language": "pt-BR",
  "edition": null,
  "translator": null,
  "publisher": "YouTube",
  "published_at": null,
  "canonical_url": "https://www.youtube.com/watch?v=NKF2v9jWeBw",
  "discovery_url": "https://youtu.be/NKF2v9jWeBw",
  "rights_status": "research_only",
  "zotero_item_key": null,
  "bibtex_key": null,
  "notes": "Kickoff seed. Title and public description discovered; channel/creator, publication date and transcript remain capture gates before factual claims are derived."
}
